{
  "$schema": "./schemas/directory.schema.json",
  "schemaVersion": 1,
  "lastVerified": "2026-10-29",
  "statusOwner": "elixpo",
  "entries": {
    "accounts.elixpo": { "slug": "accounts", "name": "Elixpo Accounts", "website": "https://accounts.elixpo.com", "icon": "/brand/icons/accounts.elixpo.webp", "summary": "Shared identity and account management for Elixpo services.", "description": "Elixpo Accounts provides the common sign-in and account layer used across supported Elixpo services, with standards-oriented OAuth 2.0 and OpenID Connect integration for applications.", "focus": ["Identity", "OAuth 2.0", "OpenID Connect"], "featured": true },
    "admin.elixpo": { "slug": "admin", "name": "Elixpo Admin", "icon": "/brand/icons/admin.elixpo.webp", "summary": "Operational administration for the Elixpo service network.", "description": "The internal administration surface used to operate and inspect supported Elixpo services. It is listed for transparency, while privileged functions remain restricted.", "focus": ["Operations", "Administration", "Infrastructure"] },
    "agent.elixpo": { "slug": "agent", "name": "Elixpoo", "website": "https://agent.elixpo.com", "icon": "/brand/icons/agent.elixpo.webp", "summary": "Elixpo's active organization-wide GitHub project-management and review agent.", "description": "Elixpoo v2 consistently classifies repository work, maintains approved labels and Project fields, answers exact mentions, provides evidence-grounded pull-request reviews, supports the canonical Discussions surface, and records bounded merged-change context. Its deterministic permission boundary prevents it from editing product source or acting as an autonomous coding agent.", "focus": ["GitHub operations", "Project management", "Review automation"], "evidence": [{ "label": "Elixpoo v2 public contract", "url": "https://agent.elixpo.com/docs" }, { "label": "Source and reusable workflows", "url": "https://github.com/elixpo/agent.elixpo" }] },
    "art.elixpo": { "slug": "art", "name": "Elixpo Art", "icon": "/brand/icons/art.elixpo.webp", "summary": "An archived creative-generation experiment from Elixpo's earlier era.", "description": "Elixpo Art is preserved as part of the organization history. It is no longer presented as an active service or maintained project.", "focus": ["Creative tooling", "Archive"] },
    "blogs.elixpo": { "slug": "blogs", "name": "LixBlogs", "website": "https://blogs.elixpo.com", "icon": "/brand/icons/blogs.elixpo.webp", "summary": "Open publishing for technical stories, rich documents, and creator workflows.", "description": "LixBlogs is Elixpo's operated publishing service. Its editor and publishing workflow support technical writing with structured blocks, diagrams, equations, code, media, and automation through a public CLI.", "focus": ["Publishing", "Technical writing", "Creator tools"], "featured": true, "programmes": [{ "label": "Proposed Google Summer of Code 2027 idea (Elixpo is applying as a mentoring organisation): LixBlogs read-access policy", "url": "https://gsoc.elixpo.com/ideas/lixblogs-read-access-policy/" }, { "label": "Proposed Google Summer of Code 2027 idea (Elixpo is applying as a mentoring organisation): LixBlogs CLI contract", "url": "https://gsoc.elixpo.com/ideas/lixblogs-cli-contract/" }] },
    "chat.elixpo": { "slug": "chat", "name": "Elixpo Chat", "icon": "/brand/icons/chat.elixpo.webp", "summary": "An archived conversational application preserved as an Elixpo project record.", "description": "Elixpo Chat is retained as a historical project record and is no longer maintained or operated as a current Elixpo service.", "focus": ["Conversation", "Archive"] },
    "claudeOps.elixpo": { "slug": "claudeops", "name": "ClaudeOps", "summary": "An archived connected optimization toolkit not maintained by Elixpo.", "description": "ClaudeOps remains visible for historical accuracy. Elixpo does not maintain the project as an active package and does not include it in current release work.", "focus": ["Developer tooling", "Archive"] },
    "clock.elixpo": { "slug": "clock", "name": "Elixpo Clock", "summary": "An archived interactive time-visualization experiment.", "description": "Elixpo Clock explored animated time and timezone interfaces. The repository is archived and retained as part of the public record.", "focus": ["Creative coding", "Time", "Archive"] },
    "crumb.elixpo": { "slug": "crumb", "name": "Crumb", "website": "https://crumb.elixpo.com", "icon": "/brand/source/icons/crumb.elixpo.png", "summary": "A self-hosted autonomous agent harness and natural language terminal powered by Pollinations.", "description": "Crumb is Elixpo's active pre-release Rust agent harness and native-first terminal. It keeps Bash, Zsh, and PowerShell behavior intact while its locally operated harness manages autonomous planning, approved tools, sessions, memory, checkpoints, background work, and agent supervision. Pollinations provides the default model intelligence without owning Crumb's execution or permission boundary.", "focus": ["Autonomous agents", "Rust", "Terminal", "Pollinations", "Self-hosted"], "featured": true, "evidence": [{ "label": "Crumb product direction", "url": "https://github.com/elixpo/crumb.elixpo/blob/main/docs/product/direction.md" }, { "label": "Crumb documentation", "url": "https://crumb.elixpo.com/docs" }], "programmes": [{ "label": "Proposed Google Summer of Code 2027 idea (Elixpo is applying as a mentoring organisation): Crumb connector contract", "url": "https://gsoc.elixpo.com/ideas/crumb-connector-contract/" }] },
    "cypher": { "slug": "cypher", "name": "Cypher", "summary": "An incubating core Elixpo application preparing for active product development.", "description": "Cypher preserves the original Safe Cypher prototype while Elixpo prepares its next development phase. The current code explores authentication, encrypted data storage, and role-based account workflows without presenting the prototype as production-ready security software.", "focus": ["Application", "Privacy", "Incubating"] },
    "elixpo_chapter": { "slug": "elixpo-chapter", "name": "Elixpo Chapter", "summary": "The master collection where public build chapters become durable releases.", "description": "Elixpo Chapter is the central repository for the foundry model: time-bounded public work, prepared contribution paths, review, release records, and the shared history of what people built together.", "focus": ["Open-source foundry", "Public releases", "Community"], "featured": true },
    "emoji_transnetv1": { "slug": "emoji-transnet", "name": "Emoji TransNet", "summary": "An archived translation experiment with a released Hugging Face model.", "description": "Emoji TransNet is an earlier Elixpo mT5 experiment for translating emoji-rich text into plain-English descriptions. The source is archived, while its public MIT-licensed model remains available as a released research artifact.", "focus": ["Machine learning", "Natural language processing", "Archive"], "evidence": [{ "label": "Emoji Contextual Translator model", "url": "https://huggingface.co/elixpo/Emoji-Contextual-Translator" }] },
    "falcon": { "slug": "falcon", "name": "Falcon", "summary": "A completed automation experiment built at deliberately unusual scale.", "description": "Falcon is a completed research-side experiment in automated repository activity. It is preserved as an intentionally playful study, including its unusually large commit history, rather than presented as an active product.", "focus": ["Automation", "Repository systems", "Experiment"] },
    "flappy6502": { "slug": "flappy6502", "name": "Flappy6502", "summary": "Flappy Bird on a breadboard R6502 computer, listed in 6502.org's Homebuilt Projects.", "description": "Flappy6502 runs Flappy Bird on a breadboard Rockwell R6502 with a 28C64 EEPROM, 32 KB SRAM and 74LS logic, driving an ST7789 LCD over bit-banged SPI from hand-tuned ca65 assembly. The repository publishes the KiCad schematic, staged build notes, ROM tooling and a py65 simulator test suite.", "focus": ["Open hardware", "6502 assembly", "Retrocomputing"], "featured": true, "evidence": [{"label": "6502.org Homebuilt Projects listing", "url": "https://6502.org/homebuilt/"}, {"label": "Source, schematic and simulator", "url": "https://github.com/elixpo/flappy6502"}] },
    "jackey.elixpo": { "slug": "jackey", "name": "Jackey", "summary": "An archived generation bot and community experiment.", "description": "Jackey is the canonical final repository for an earlier Elixpo bot project. It is archived and remains available as a historical implementation record.", "focus": ["Bots", "Creative tooling", "Archive"] },
    "Kareixo": { "slug": "kareixo", "name": "Kareixo", "summary": "An independently led Member Project building within the Elixpo commons.", "description": "Kareixo is an active Elixpo Member Project transferred by its maintainer while retaining visible author agency. It demonstrates the long-term member-project path beyond a time-bounded Chapter.", "focus": ["Member Project", "Independent maintenance", "Software"], "featured": true },
    "lixrl.com": { "slug": "lixrl", "name": "Lixrl", "website": "https://lixrl.com", "icon": "/brand/icons/url.elixpo.webp", "summary": "Short links, managed redirects, analytics, and production-ready QR codes.", "description": "Lixrl is an actively operated Elixpo service for shortening and managing links, observing their use, and generating QR codes. Its companion CLI supports repeatable developer and automation workflows.", "focus": ["Short links", "QR codes", "Analytics"], "featured": true },